{
  "@context": [
    "https://lineage.dev/contexts/ai-bom/v0.1",
    {
      "c2pa": "https://c2pa.org/specifications/specifications/2.1/specs/C2PA_Specification.html#"
    }
  ],
  "type": "LineageAIBillOfMaterials",
  "schemaVersion": "0.1.0",
  "manifestId": "urn:lineage:manifest:prj_week_zero_provenance",
  "project": {
    "id": "prj_week_zero",
    "name": "Week Zero Provenance Chain",
    "externalIds": [
      {
        "system": "internal-slate",
        "value": "LNG-0001"
      }
    ]
  },
  "generatedAt": "2026-05-20T15:10:00-04:00",
  "issuer": {
    "id": "lineage-local-dev",
    "name": "LINEAGE Local Development Issuer"
  },
  "events": [
    {
      "eventId": "evt_runway0101",
      "timestamp": "2026-05-20T14:40:00-04:00",
      "projectId": "prj_week_zero",
      "tool": {
        "identifier": "runway-ml",
        "version": "web-2026-05-20",
        "url": "https://app.runwayml.com"
      },
      "model": {
        "identifier": "gen-3-alpha"
      },
      "input": {
        "promptText": "A wide desert road at sunrise, camera mounted low to the asphalt.",
        "referenceAssets": []
      },
      "output": {
        "assetUrl": "https://assets.example.com/week-zero/desert-plate.mp4",
        "assetHash": {
          "algorithm": "SHA-256",
          "value": "aaaaaaaaaaaaaaaaaaaaaaaaaaaaaaaaaaaaaaaaaaaaaaaaaaaaaaaaaaaaaaaa"
        },
        "assetType": "video",
        "mimeType": "video/mp4",
        "durationSeconds": 8
      },
      "operator": {
        "userId": "user_local_001",
        "humanName": "Jordan Lee"
      },
      "provenance": {
        "parentEventIds": []
      }
    },
    {
      "eventId": "evt_runway0102",
      "timestamp": "2026-05-20T14:48:12-04:00",
      "projectId": "prj_week_zero",
      "tool": {
        "identifier": "runway-ml",
        "version": "web-2026-05-20",
        "url": "https://app.runwayml.com"
      },
      "model": {
        "identifier": "gen-3-alpha"
      },
      "input": {
        "promptText": "Extend the desert road shot with a blue electric coupe entering frame from camera right.",
        "parameters": {
          "durationSeconds": 5,
          "seed": 1844201
        },
        "referenceAssets": [
          {
            "assetUrl": "https://assets.example.com/week-zero/desert-plate.mp4",
            "assetHash": {
              "algorithm": "SHA-256",
              "value": "aaaaaaaaaaaaaaaaaaaaaaaaaaaaaaaaaaaaaaaaaaaaaaaaaaaaaaaaaaaaaaaa"
            },
            "assetType": "video",
            "relationship": "input"
          }
        ]
      },
      "output": {
        "assetUrl": "https://assets.example.com/week-zero/desert-car-extension.mp4",
        "assetHash": {
          "algorithm": "SHA-256",
          "value": "bbbbbbbbbbbbbbbbbbbbbbbbbbbbbbbbbbbbbbbbbbbbbbbbbbbbbbbbbbbbbbbb"
        },
        "assetType": "video",
        "mimeType": "video/mp4",
        "durationSeconds": 5
      },
      "operator": {
        "userId": "user_local_001",
        "humanName": "Jordan Lee"
      },
      "provenance": {
        "parentEventIds": [
          "evt_runway0101"
        ]
      }
    }
  ],
  "c2pa": {
    "specVersion": "2.1",
    "manifestType": "standard",
    "assertionStoreLabel": "c2pa.assertions",
    "claimLabel": "c2pa.claim.v2",
    "claimSignatureLabel": "c2pa.signature",
    "claimGenerator": "LINEAGE/0.1.0",
    "signatureAlgorithm": "EdDSA",
    "signaturePayloadMode": "detached",
    "actions": [
      {
        "action": "c2pa.created",
        "when": "2026-05-20T14:40:00-04:00",
        "softwareAgent": "Runway ML gen-3-alpha",
        "lineageEventId": "evt_runway0101"
      },
      {
        "action": "c2pa.edited",
        "when": "2026-05-20T14:48:12-04:00",
        "softwareAgent": "Runway ML gen-3-alpha",
        "lineageEventId": "evt_runway0102"
      }
    ]
  },
  "signature": {
    "type": "LineageEd25519Signature2026",
    "createdAt": "2026-05-20T15:10:00-04:00",
    "algorithm": "Ed25519",
    "encoding": "base64url",
    "publicKey": {
      "kid": "lineage-local-dev-key-001",
      "kty": "OKP",
      "crv": "Ed25519",
      "x": "BBBBBBBBBBBBBBBBBBBBBBBBBBBBBBBBBBBBBBBBBBB"
    },
    "signedPayload": "canonical-json-without-signature",
    "digest": {
      "algorithm": "SHA-256",
      "value": "1111111111111111111111111111111111111111111111111111111111111111"
    },
    "signatureValue": "AAAAAAAAAAAAAAAAAAAAAAAAAAAAAAAAAAAAAAAAAAAAAAAAAAAAAAAAAAAAAAAAAAAAAAAAAAAAAAAAAAAAAA",
    "c2pa": {
      "claimSignatureLabel": "c2pa.signature",
      "coseSignatureStructure": "COSE_Sign1_Tagged",
      "coseAlgorithm": "EdDSA",
      "payloadMode": "detached",
      "externalAAD": ""
    }
  }
}
